{
  "schema_version": 1,
  "reviewer": "senior_logic_reviewer",
  "overall_summary": "중심 주장은 대체로 식별된다. 테스트는 코드 전체의 안전을 보장하는 것이 아니라, 주어진 입력과 기대값에 대해 흔들리지 않는 판정 기준이어야 한다는 주장이다. 다만 사례가 그 주장의 어느 부분을 증명하는지, AI 평가가 어떻게 흔들렸는지, 결함 주입 결과를 어떻게 해석해야 하는지의 근거가 부족해 시니어 질문에는 아직 취약하다.",
  "findings": [
    {
      "criterion": "thesis_identifiability",
      "status": "caution",
      "evidence": [
        {
          "token_ids": [
            "t0038",
            "t0039",
            "t0040",
            "t0041",
            "t0042",
            "t0043"
          ],
          "quote": "근데 테스트가 있다고 정말 안전한 걸까요?"
        },
        {
          "token_ids": [
            "t0350",
            "t0351",
            "t0352",
            "t0353",
            "t0354",
            "t0355",
            "t0356",
            "t0357",
            "t0358",
            "t0359",
            "t0360",
            "t0361",
            "t0362",
            "t0363"
          ],
          "quote": "결론적으로 테스트란 것은 먼저 인상으로 결정한 것이 아니라 흔들리지 않는 절대적 게이트라는 것이 중요합니다."
        }
      ],
      "observation": "발표자는 테스트가 있다고 안전한지 묻고, 결론에서 테스트를 인상이 아니라 흔들리지 않는 게이트라고 규정한다.",
      "inference": "청중은 중심 주장을 '테스트는 안전 그 자체가 아니라 반복 가능한 판정 기준이어야 한다'로 이해할 가능성이 높다.",
      "missing_evidence": "도입부에서 '판정'과 '안전'의 차이를 한 문장으로 먼저 고정하지 않아, 초반에는 테스트 일반론처럼 들릴 여지가 있다.",
      "diagnosis": "주장은 보이지만 늦게 선명해진다. 특히 '절대적 게이트'라는 표현이 뒤의 한정된 보장 주장과 함께 들리며 범위가 모호해진다.",
      "action": "초반에 테스트가 보장하는 것은 전체 안전이 아니라 특정 입력과 기대값에 대한 반복 가능한 판정이라는 한정된 thesis를 명시하라."
    },
    {
      "criterion": "reasoning_chain",
      "status": "caution",
      "evidence": [
        {
          "token_ids": [
            "t0105",
            "t0106",
            "t0107",
            "t0108",
            "t0109",
            "t0110",
            "t0111",
            "t0112",
            "t0113",
            "t0114",
            "t0115",
            "t0116",
            "t0117",
            "t0118",
            "t0119",
            "t0120",
            "t0121",
            "t0122",
            "t0123"
          ],
          "quote": "테스트의 초록 빨강은 그 테스트가 주어진 입력에 대해서 이제 동작을 보장한다는 것이지 모든 케이스에 대해서 그것이 안전하다는 것은 아닙니다."
        },
        {
          "token_ids": [
            "t0413",
            "t0414",
            "t0415",
            "t0416",
            "t0417",
            "t0418",
            "t0419",
            "t0420",
            "t0421",
            "t0422",
            "t0423",
            "t0424",
            "t0425",
            "t0426",
            "t0427",
            "t0428",
            "t0429",
            "t0430",
            "t0431",
            "t0432",
            "t0433",
            "t0434",
            "t0435",
            "t0436",
            "t0437",
            "t0438",
            "t0439",
            "t0440",
            "t0441",
            "t0442",
            "t0443",
            "t0444",
            "t0445"
          ],
          "quote": "그래서 테스트 코드가 그냥 단순히 있는 게 아니라 가장 중요한 것은 이것을 통과하는 입력이 어떤 것인지 이것이 정말 어떤 것을 보장하는 것인지 이 테스트가 그냥 잘못된 것은 아닌지 그런 것이 더 중요하다고 생각합니다."
        }
      ],
      "observation": "초록의 의미를 주어진 입력에 대한 보장으로 제한하고, 이후 통과 입력과 보장 내용을 확인해야 한다고 연결한다.",
      "inference": "논리 흐름은 '테스트 존재 여부 → 초록의 제한된 의미 → 입력과 결함 주입 확인 → 게이트로서의 테스트'로 이어진다.",
      "missing_evidence": "각 단계 사이의 인과가 압축되어 있다. 왜 결함 주입이 테스트의 판정 능력을 검증하는지, 어떤 경우에는 결함 주입 해석이 부적절한지 설명이 부족하다.",
      "diagnosis": "큰 흐름은 따라갈 수 있지만 중간 연결고리가 충분히 명시되지 않는다. 청중이 이미 테스트 설계와 mutation testing의 의미를 알고 있어야 빈칸을 메울 수 있다.",
      "action": "결함 주입이 '테스트가 실패해야 할 변경에서 실제로 실패하는지 확인하는 절차'라는 연결을 명시하고, 그 결과가 무엇을 말해주는지 분리해서 설명하라."
    },
    {
      "criterion": "evidence_fit",
      "status": "caution",
      "evidence": [
        {
          "token_ids": [
            "t0243",
            "t0244",
            "t0245",
            "t0246",
            "t0247",
            "t0248",
            "t0249",
            "t0250",
            "t0251",
            "t0252",
            "t0253",
            "t0254",
            "t0255",
            "t0256",
            "t0257",
            "t0258",
            "t0259",
            "t0260",
            "t0261",
            "t0262",
            "t0263",
            "t0264",
            "t0265",
            "t0266",
            "t0267",
            "t0268",
            "t0269",
            "t0270"
          ],
          "quote": "결과가 흔들리고 있는 거죠. 하지만 내가 만든 인스테스트 18종을 검증했을 때는 18개 중에 16개를 통과했고 예를 들어서 2개는 틀림 명확한 응답을 얻었다고 항상 동일한 결과와 피드백이 온 것이죠."
        },
        {
          "token_ids": [
            "t0273",
            "t0274",
            "t0275",
            "t0276",
            "t0277",
            "t0278",
            "t0281",
            "t0282",
            "t0283",
            "t0284",
            "t0285",
            "t0286",
            "t0287",
            "t0288",
            "t0289",
            "t0290",
            "t0291",
            "t0292",
            "t0293",
            "t0294",
            "t0295",
            "t0296",
            "t0297",
            "t0298",
            "t0299",
            "t0300",
            "t0301",
            "t0302",
            "t0303"
          ],
          "quote": "하지만 초록이 항상 옳았냐? 그건 아닙니다. 이 테스트가. 예를 들어서 제 일할계산 부분이 테스트 케이스로 커버리지가 되어 있었지만 반올림 부분에서 올림 부분만 커버리지가 되어 있고 버림 부분은 사실 입력이 되지 않아서"
        }
      ],
      "observation": "환불 도메인 18개 인수 테스트 사례와 일할계산 커버리지 사례를 증거로 제시한다.",
      "inference": "첫 사례는 테스트가 AI 평가보다 반복 가능한 판정을 줄 수 있다는 점을, 둘째 사례는 초록과 커버리지가 완전한 안전을 뜻하지 않는다는 점을 지지한다.",
      "missing_evidence": "AI 평가가 몇 번 어떻게 달라졌는지, 18개 중 실패한 2개가 어떤 요구사항을 검증했는지, 일할계산에서 실제 기대값과 실패 조건이 무엇인지가 없다.",
      "diagnosis": "사례 방향은 주장과 맞지만 증거의 해상도가 낮다. 숫자는 나오지만 그 숫자가 정확히 어떤 claim을 지지하는지 확인하기 어렵다.",
      "action": "각 사례마다 '무엇을 비교했는지', '무엇이 실패했는지', '그 실패가 어떤 결론을 지지하는지'를 한 줄씩 붙여라."
    },
    {
      "criterion": "assumptions_and_scope",
      "status": "problem",
      "evidence": [
        {
          "token_ids": [
            "t0130",
            "t0131",
            "t0132",
            "t0133",
            "t0134"
          ],
          "quote": "사각지대는 언제든 나올 수 있습니다."
        },
        {
          "token_ids": [
            "t0358",
            "t0359",
            "t0360",
            "t0361",
            "t0362",
            "t0363"
          ],
          "quote": "흔들리지 않는 절대적 게이트라는 것이 중요합니다."
        }
      ],
      "observation": "발표자는 사각지대가 언제든 나올 수 있다고 말하면서도 테스트를 절대적 게이트라고 부른다.",
      "inference": "의도는 '정해진 범위 안에서는 반복 가능한 게이트'일 가능성이 높지만, 실제 발화만 보면 게이트의 범위가 불명확하다.",
      "missing_evidence": "테스트 게이트가 유효한 전제, 예를 들어 입력 선택, 기대값의 정확성, 외부 의존성 대역, 라이브러리 업데이트 같은 범위 밖 위험의 처리 기준이 제시되지 않았다.",
      "diagnosis": "범위 설정이 가장 큰 약점이다. '절대적'이라는 단어가 테스트의 한정된 보장이라는 앞선 주장보다 강하게 들려 과대 주장으로 공격받기 쉽다.",
      "action": "게이트의 범위를 '명세화된 입력과 기대값 안에서'로 제한하고, 그 밖의 사각지대는 별도의 확인이나 계약 테스트가 필요하다고 경계를 세워라."
    },
    {
      "criterion": "consistency",
      "status": "caution",
      "evidence": [
        {
          "token_ids": [
            "t0117",
            "t0118",
            "t0119",
            "t0120",
            "t0121",
            "t0122",
            "t0123"
          ],
          "quote": "모든 케이스에 대해서 그것이 안전하다는 것은 아닙니다."
        },
        {
          "token_ids": [
            "t0384",
            "t0385",
            "t0386",
            "t0387",
            "t0388",
            "t0389",
            "t0390",
            "t0391"
          ],
          "quote": "하지만 아까 말했듯이 그것이 항상 안전하다는 것은 아닙니다."
        }
      ],
      "observation": "발표자는 초록이 모든 안전을 뜻하지 않는다는 한정을 앞과 뒤에서 반복한다.",
      "inference": "핵심 입장은 일관되게 '테스트는 제한된 보장만 한다'에 가깝다.",
      "missing_evidence": "그 한정과 '절대적 게이트'라는 표현이 어떻게 동시에 성립하는지 명시적으로 정리되지 않았다.",
      "diagnosis": "발표 내부에 직접 모순은 크지 않지만, 강한 표현과 한정 표현이 충돌해 들릴 수 있다.",
      "action": "'절대적'을 '반복 가능한' 또는 '정해진 범위 안에서 흔들리지 않는'으로 바꾸거나, 발표 안에서 같은 의미로 정의하라."
    },
    {
      "criterion": "conclusion_support",
      "status": "caution",
      "evidence": [
        {
          "token_ids": [
            "t0457",
            "t0458",
            "t0459",
            "t0460",
            "t0461",
            "t0462",
            "t0463",
            "t0464",
            "t0465",
            "t0466",
            "t0467",
            "t0468",
            "t0469",
            "t0470",
            "t0471",
            "t0472",
            "t0473",
            "t0474",
            "t0475"
          ],
          "quote": "테스트 코드가 있다면 초록인 테스트 코드를 하나 골라서 부등호 하나를 집어보는 겁니다. 혹은 입력을 바꿔보던가 코드를 조금 바꿔보는 겁니다."
        },
        {
          "token_ids": [
            "t0476",
            "t0477",
            "t0478",
            "t0479",
            "t0480",
            "t0481",
            "t0482",
            "t0483",
            "t0484",
            "t0485",
            "t0486",
            "t0487",
            "t0488",
            "t0489",
            "t0490",
            "t0491",
            "t0492",
            "t0493",
            "t0494",
            "t0495",
            "t0496",
            "t0497",
            "t0498",
            "t0499",
            "t0500",
            "t0501",
            "t0502",
            "t0503",
            "t0504",
            "t0505",
            "t0506",
            "t0507",
            "t0508",
            "t0509"
          ],
          "quote": "그렇다면 그 코드가 계속 초록이라면 당신은 정말 쓸모없는 테스트 코드를 하나 버려낼 수 있고 그 테스트가 빨강으로 변했다면 이 테스트가 정말 어떤 걸 검증하고 있구나 중요한 걸 검증하고 있구나 라는 것을 알 수 있습니다."
        }
      ],
      "observation": "마무리는 초록인 테스트에 작은 변경을 넣어보고, 계속 초록이면 쓸모없는 테스트를 버리고 빨강이면 검증 대상을 알 수 있다고 권한다.",
      "inference": "이 결론은 테스트가 실제로 결함을 잡는지 확인하자는 발표의 중심 주장과 연결된다.",
      "missing_evidence": "부등호 변경이나 입력 변경이 항상 유효한 결함 주입인지, 계속 초록인 테스트가 언제 '쓸모없다'고 판단 가능한지의 조건이 없다.",
      "diagnosis": "실천 제안은 강하지만 해석 조건이 빠져 있다. 그대로 말하면 유효한 테스트를 잘못 버리거나, 범위 밖 변경을 테스트 실패 기준으로 삼는 위험을 설명하지 못한다.",
      "action": "결론에서 '의도한 동작을 깨뜨리는 변경을 넣었는데도 초록이면'처럼 판단 조건을 붙여라."
    },
    {
      "criterion": "question_resilience",
      "status": "problem",
      "evidence": [
        {
          "token_ids": [
            "t0208",
            "t0209",
            "t0210",